Card Name,Issuer,Joining Fee,Annual Fee,Annual Fee Waiver,Reward Structure,Premium Services,Travel Benefits,Lifestyle Benefits,Min Credit Score,Min Income Requirement,Ideal For
HDFC Diners Club Black Credit Card,HDFC Bank,10000,10000,Spend ₹8 lakhs annually,"{'Base': '5 reward points per ₹150 spent (3.33% reward rate)', 'Dining': '2X rewards on weekend dining', 'Shopping': '10X rewards on SmartBuy', 'Travel': 'Regular reward points'}","['Unlimited domestic and international airport lounge access', 'Club Marriott membership', 'Forbes subscription', 'Amazon Prime membership', 'MMT BLACK membership', 'Concierge services']","['Low forex markup (2%)', 'Complimentary airport transfers', 'Travel insurance up to ₹2 crores']","['6 complimentary golf games quarterly', 'Buy 1 Get 1 on movie tickets', 'Premium dining offers']",800,1500000,"['Luxury travelers', 'High spenders', 'Dining enthusiasts']"
Amazon Pay ICICI Credit Card,ICICI Bank,0,0,,"{'Base': '1% reward points on all spends', 'Amazon': '5% for Prime members, 3% for non-Prime', 'Travel': '1% rewards', 'Fuel': '1% rewards (excluding surcharge waivers)'}",[],[],"['Amazon Pay balance as rewards', 'No-cost EMI on Amazon']",650,300000,"['Amazon shoppers', 'Online shoppers', 'No-fee card seekers']"
SBI SimplyCLICK Credit Card,SBI Cards,499,499,Spend ₹1 lakh annually,"{'Base': '1 reward point per ₹100 spent (1%)', 'Online Partners': '5X rewards on Amazon, BookMyShow, etc.', 'Dining': 'Regular rewards', 'Travel': 'Regular rewards'}",[],[],"['E-vouchers on milestone spends', 'Discounts on partner websites']",650,300000,"['Online shoppers', 'Digital-first users', 'Moderate spenders']"
HDFC Regalia Credit Card,HDFC Bank,2500,2500,Based on spending patterns,"{'Base': '4 reward points per ₹150 spent (2.67%)', 'Travel': 'Regular reward points', 'Dining': 'Regular reward points', 'Shopping': 'Regular reward points'}","['Airport lounge access (12 per year)', 'Concierge service', 'Golf program']","['Complimentary Priority Pass membership', 'Travel insurance', 'Airline benefits']","['Milestone benefits', 'Dining offers at premium restaurants']",750,600000,"['Frequent travelers', 'Premium lifestyle users', 'Lounge access seekers']"
Flipkart Axis Bank Credit Card,Axis Bank,500,500,On spending ₹2 lakhs annually,"{'Base': '1.5% unlimited cashback on all purchases', 'Flipkart/Myntra': '5% unlimited cashback', 'Preferred Partners': '4% unlimited cashback', 'Fuel': '1% cashback with surcharge waiver'}",[],['4 domestic airport lounge visits per year'],"['Welcome benefits worth ₹500', 'Movie ticket discounts']",700,360000,"['Flipkart shoppers', 'Online shoppers', 'Cashback seekers']"
Standard Chartered Manhattan Credit Card,Standard Chartered,999,999,"On spending ₹90,000 in previous year","{'Base': '5 reward points per ₹150 spent', 'Dining': 'Up to 20% cashback at partner restaurants', 'Groceries': 'Regular reward points', 'Travel': 'Regular reward points'}",[],[],"['Dining offers', 'Movie ticket discounts']",650,300000,"['Urban professionals', 'Dining enthusiasts', 'Movie lovers']"
American Express Platinum Card,American Express,60000,60000,,"{'Base': '3 membership rewards points per ₹100 spent', 'Travel': 'Premium rewards on travel bookings', 'Dining': 'Premium rewards at select restaurants', 'Shopping': 'Premium rewards at luxury retailers'}","['Unlimited airport lounge access', 'Dedicated concierge', 'Valet parking', 'Taj Epicure Plus membership', 'ITC Club lounge access', 'Fine Hotels & Resorts program']","['5X rewards on travel', 'Airline credits', 'Hotel upgrades', 'Premium car rentals']","['Dining offers at premium restaurants', 'Exclusive event access', 'Shopping privileges']",800,2500000,"['Ultra HNIs', 'Luxury lifestyle seekers', 'Frequent international travelers']"
HDFC Millennia Credit Card,HDFC Bank,1000,1000,On spending ₹1 lakh in a year,"{'Base': '1% cashback on all online spends', 'Wallet Loading': '5% cashback on wallet loading', 'Shopping': '2.5% cashback on weekend spends (online)', 'Utilities': '1% cashback'}",[],['2 domestic airport lounge access per quarter'],"['Movie ticket offers', '1% fuel surcharge waiver']",700,360000,"['Millennials', 'Digital payment users', 'Online shoppers']"
SBI ELITE Credit Card,SBI Cards,4999,4999,On spending ₹4 lakhs in a year,"{'Base': '2 reward points per ₹100 spent', 'Dining': '5 reward points per ₹100', 'Grocery': '5 reward points per ₹100', 'Travel': 'Regular reward points'}","['Priority customer service', 'Concierge services']","['6 airport lounge access per quarter', 'Milestone reward of air tickets']","['Movie discounts', 'Exclusive dining offers', 'Golf privileges']",750,720000,"['Luxury lifestyle seekers', 'Frequent travelers', 'High spenders']"
ICICI Bank Emeralde Credit Card,ICICI Bank,12000,12000,,"{'Base': '4 ICICI Bank reward points per ₹100 spent', 'Travel': 'Premium reward points', 'Dining': 'Premium reward points', 'Shopping': 'Premium reward points'}","['Premium Concierge', 'Priority service', 'Dedicated relationship manager']","['Unlimited airport lounge access', 'Complimentary hotel night stays', 'Travel insurance']","['Fine dining privileges', 'Luxury shopping benefits', 'Golf privileges']",800,2000000,"['HNIs', 'Premium lifestyle seekers', 'Frequent travelers']"
Axis Bank Vistara Infinite Credit Card,Axis Bank,10000,10000,Partial waiver on spending ₹8 lakhs annually,"{'Base': '8 CV Points per ₹200 spent (4%)', 'Vistara': '10 CV Points per ₹200 spent on Vistara (5%)', 'Dining': '6 CV Points per ₹200 spent (3%)', 'Foreign Currency': '4 CV Points per ₹200 spent (2%)'}","['Priority check-in', 'Concierge services']","['Complimentary Club Vistara Gold membership', 'Free tickets on milestone spends', 'Unlimited domestic lounge access', '6 international lounge access per year']","['2 complimentary movie tickets per month', 'Dining offers']",750,1000000,"['Frequent Vistara flyers', 'Travel enthusiasts', 'Premium travelers']"
IDFC FIRST Wealth Credit Card,IDFC FIRST Bank,3000,3000,On spending ₹5 lakhs annually,"{'Base': '3 reward points per ₹100 spent (3%)', 'Travel': '10 reward points per ₹100 on flights (10%)', 'Dining': '10 reward points per ₹100 (10%)', 'Shopping': 'Regular reward points'}","['Concierge service', 'Priority customer service']","['Unlimited domestic airport lounge access', '2 international lounge access per quarter', 'Complimentary airline tickets on milestone spends']","['Movie ticket discounts', 'Fine dining offers', 'Hotel discounts']",750,750000,"['Frequent travelers', 'Dining enthusiasts', 'Premium lifestyle users']"
Citi Prestige Credit Card,Citibank,20000,20000,,"{'Base': '3 reward points per ₹100 spent', 'Travel': '10 reward points per ₹100 spent on airline transactions', 'Dining': '10 reward points per ₹100 spent', 'Shopping': 'Regular reward points'}","['24/7 Dedicated concierge', 'Meet & Assist service at airports', 'Hertz Gold Plus membership']","['Unlimited airport lounge access', '4th night free at hotels', 'Complimentary airport transfers']","['Golf privileges', 'Dining privileges with Citi Gourmet Pleasures', 'Special events access']",800,1500000,"['Frequent international travelers', 'Luxury hotel stayers', 'High-end lifestyle users']"
HSBC Visa Platinum Credit Card,HSBC,0,0,,"{'Base': '2 reward points per ₹100 spent', 'Travel': 'Regular reward points', 'Dining': 'Regular reward points', 'Shopping': 'Regular reward points'}",[],['Complimentary access to airport lounges'],"['Dining privileges', 'Movie ticket discounts', 'Fuel surcharge waiver']",700,300000,"['New credit card users', 'No-fee card seekers', 'Moderate spenders']"
Kotak 811 Dream Different Credit Card,Kotak Mahindra Bank,0,0,,"{'Base': 'Up to 1% unlimited cashback', 'Travel': 'Regular rewards', 'Dining': 'Regular rewards', 'Shopping': 'Regular rewards'}",[],[],"['1% fuel surcharge waiver', 'Instant approval', 'Up to 50% off on movie tickets']",650,300000,"['First-time credit card users', 'Digital banking users', 'Cashback seekers']"
IndusInd Iconia Amex Credit Card,IndusInd Bank,10000,10000,On spending ₹5 lakhs annually,"{'Base': '1.5 reward points per ₹100 spent', 'Travel': '2 reward points per ₹100 spent', 'Dining': '2 reward points per ₹100 spent', 'Shopping': 'Regular reward points'}","['Taj InnerCircle Epicure membership', 'Concierge service']","['8 complimentary airport lounge visits per year', 'Premium hotel privileges']","['Buy-one-get-one movie tickets', 'Dining privileges', 'Milestone benefits']",750,1000000,"['Premium lifestyle users', 'Travel enthusiasts', 'Fine dining lovers']"
RBL Bank Shoprite Credit Card,RBL Bank,0,0,,"{'Base': '1 reward point per ₹100 spent', 'Shopping Partners': '10 reward points per ₹100 spent', 'Dining': 'Regular reward points', 'Travel': 'Regular reward points'}",[],[],"['Welcome vouchers', 'Merchant offers', 'Fuel surcharge waiver']",650,240000,"['Online shoppers', 'No-fee card seekers', 'Budget-conscious users']"
YES Bank Premia Credit Card,YES Bank,2499,2499,On spending ₹3 lakhs annually,"{'Base': '2 reward points per ₹100 spent', 'Travel': '12 reward points per ₹100 on flight bookings', 'Dining': '8 reward points per ₹100', 'Shopping': 'Regular reward points'}","['Priority customer service', 'Dedicated relationship manager']","['Complimentary domestic lounge access', '4 international lounge access per year']","['Movie ticket discounts', 'Golf privileges', 'Dining privileges']",700,500000,"['Frequent travelers', 'Golf enthusiasts', 'Premium lifestyle users']"
ICICI Bank HPCL Coral Credit Card,ICICI Bank,199,199,,"{'Base': '2 reward points per ₹100 spent', 'Fuel (HPCL)': '5% cashback', 'Groceries': 'Regular reward points', 'Travel': 'Regular reward points'}",[],[],"['Fuel surcharge waiver at HPCL', 'Movie ticket offers']",650,240000,"['Frequent drivers', 'Vehicle owners', 'Budget-conscious users']"
SBI Card PRIME,SBI Cards,2999,2999,On spending ₹3 lakhs annually,"{'Base': '2 reward points per ₹100 spent', 'Dining': '5 reward points per ₹100', 'Grocery': '5 reward points per ₹100', 'Travel': 'Regular reward points'}",[],"['8 airport lounge visits per year', 'Milestone travel vouchers']","['Movie discount at BookMyShow', 'Dining offers', 'Fuel surcharge waiver']",700,500000,"['Premium lifestyle users', 'Dining enthusiasts', 'Grocery spenders']"
HDFC Infinia Credit Card,HDFC Bank,By invitation only,By invitation only,,"{'Base': '5 reward points per ₹150 spent (3.33%)', 'Travel': 'Regular reward points', 'Dining': 'Regular reward points', 'Shopping': '10X rewards via SmartBuy'}","['24/7 Concierge service', 'Priority customer service', 'Premium rewards redemption']","['Unlimited airport lounge access', 'Complimentary Priority Pass membership', 'Air accident cover up to ₹3 crores']","['Golf privileges', 'Premium dining experiences', '1% fuel surcharge waiver']",850,3000000,"['Ultra HNIs', 'Luxury lifestyle seekers', 'Frequent international travelers']"
Axis Bank ACE Credit Card,Axis Bank,499,499,On spending ₹2 lakhs annually,"{'Base': '2% cashback on bill payments, utilities, and fuel', 'Travel': 'Regular rewards', 'Dining': 'Regular rewards', 'Shopping': 'Regular rewards'}",[],['4 domestic airport lounge visits per year'],"['Welcome benefits', 'Fuel surcharge waiver', 'Movie ticket discounts']",650,300000,"['Utility bill payers', 'Fuel spenders', 'Digital payment users']"
Bajaj Finserv RBL Bank SuperCard,RBL Bank,500,500,On spending ₹1.5 lakhs annually,"{'Base': '1 reward point per ₹100 spent', 'Travel': 'Regular reward points', 'Dining': 'Regular reward points', 'Shopping': 'Regular reward points'}",[],['2 complimentary domestic airport lounge access per quarter'],"['Interest-free ATM withdrawals for up to 50 days', 'Convert purchases to EMI', 'Emergency loan facility']",700,360000,"['EMI seekers', 'Financial flexibility seekers', 'Emergency fund users']"
HDFC MoneyBack Credit Card,HDFC Bank,500,500,"On spending ₹50,000 annually","{'Base': '2 reward points per ₹150 spent', 'Dining': '10 reward points per ₹150 spent (weekend only)', 'Shopping': '10 reward points per ₹150 spent (weekend only)', 'Travel': 'Regular reward points'}",[],[],"['1% fuel surcharge waiver', 'Milestone benefits']",650,240000,"['Cashback seekers', 'Weekend spenders', 'Moderate spenders']"
AU Small Finance Bank LIT Credit Card,AU Small Finance Bank,0,0,,"{'Base': '1% unlimited cashback on all spends', 'Subscriptions': '3% cashback', 'Dining': 'Regular cashback', 'Travel': 'Regular cashback'}",[],['Airport lounge access'],"['Fuel surcharge waiver', 'Subscription benefits', 'Customizable rewards']",650,240000,"['Subscription users', 'Cashback seekers', 'Digital-first users']"
ICICI Bank Coral Credit Card,ICICI Bank,500,500,On spending ₹1.5 lakhs annually,"{'Base': '2 reward points per ₹100 spent', 'Travel': 'Regular reward points', 'Dining': 'Regular reward points', 'Shopping': 'Regular reward points'}",[],['Quarterly railway lounge access'],"['25% discount on movie tickets', 'Dining offers', 'Fuel surcharge waiver']",650,240000,"['Movie enthusiasts', 'Entry-level premium card users', 'Budget-conscious spenders']"
Axis Bank My Zone Credit Card,Axis Bank,500,500,"On spending ₹50,000 annually","{'Base': '1 reward point per ₹100 spent', 'Online': '2 reward points per ₹100 spent', 'Dining': 'Regular reward points', 'Travel': 'Regular reward points'}",[],[],"['Buy-one-get-one movie tickets', '25% off on dining', 'Fuel surcharge waiver']",650,240000,"['Young professionals', 'Entertainment seekers', 'Dining enthusiasts']"
SBI SimplySAVE Credit Card,SBI Cards,499,499,On spending ₹1 lakh annually,"{'Base': '1 reward point per ₹100 spent', 'Dining': '10 reward points per ₹100 spent', 'Grocery': '10 reward points per ₹100 spent', 'Travel': 'Regular reward points'}",[],[],"['Fuel surcharge waiver', 'Movie ticket discounts']",650,240000,"['Grocery shoppers', 'Dining enthusiasts', 'Everyday spenders']"
American Express Membership Rewards Credit Card,American Express,1000,1000,First year free,"{'Base': '1 membership rewards point per ₹50 spent', 'Travel': 'Regular reward points', 'Dining': 'Regular reward points', 'Shopping': 'Regular reward points'}",['American Express service promise'],['Travel and flight booking offers'],"['Dining offers', 'Shopping offers']",700,480000,"['Amex network enthusiasts', 'Point collectors', 'Customer service seekers']"
IDFC FIRST Millennia Credit Card,IDFC FIRST Bank,0,0,,"{'Base': '1 reward point per ₹100 spent', 'Online Spending': '3 reward points per ₹100 spent', 'Dining': 'Regular reward points', 'Travel': 'Regular reward points'}",[],['Airport lounge access'],"['Fuel surcharge waiver', 'Milestone benefits', 'Movie ticket discounts']",650,360000,"['Young professionals', 'First-time credit card users', 'Online shoppers']"
Axis Bank Magnus Credit Card,Axis Bank,10000,10000,On spending ₹7 lakhs annually,"{'Base': '12 EDGE REWARD POINTS for every ₹200 spent (6%)', 'Travel': 'Regular reward points', 'Dining': 'Regular reward points', 'Shopping': 'Regular reward points'}","['Concierge services', 'Premium customer service']","['Unlimited airport lounge access', 'Complimentary hotel night stays', 'Multi-trip travel insurance']","['Welcome gift vouchers', 'Milestone benefits', 'Fine dining privileges', 'Golf privileges']",750,1200000,"['Luxury lifestyle seekers', 'Frequent travelers', 'High spenders']"
